ชื่อสมุนไพร ,ชื่ออื่นๆ,ชื่อวิทยาศาสตร์,ชื่อพ้อง,ชื่อวงศ์,ลักษณะทางพฤกษศาสตร์,สรรพคุณ,องค์ประกอบทางเคมี,การศึกษาทางเภสัชวิทยา,เอกสารอ้างอิง
กะตังใบ,ต้างไก่ (อุบลราชธานี) คะนางใบ(ตราด) ตองจ้วม ตองต้อม(เหนือ) บั่งบายต้น(ตรัง) ช้างเขิง ดังหวาย (นราธิวาส) เรือง,Leea indica  (Burm.f.) Merr.,L. javanica,Leeaceae,ไม้พุ่มหรือไม้ต้นขนาดเล็ก สูงประมาณ 1-3 เมตร แตกกิ่งก้านตั้งแต่โคนต้นลำต้นเกลี้ยง หรือปกคลุมด้วยขนสั้นๆใบเป็นใบประกอบแบบขนนก 1-3 ชั้น ใบย่อยมี 3-7 ใบ ถึงจำนวนมาก ปลายใบคี่ เรียงแบบสลับ ใบย่อยออกเป็นคู่ตรงข้าม หูใบรูปไข่กลับ แผ่เป็นแผ่น กว้างได้ถึง 4 เซนติเมตร ยาว 6 เซนติเมตร มักจะเกลี้ยง หรือมีขนประปราย หูใบร่วงง่าย ทำให้เกิดรอยแผลเป็นรูปสามเหลี่ยมกว้าง แกนกลางใบยาว 10-35 เซนติเมตร เกลี้ยง หรือมีขนสั้นปกคลุม ใบย่อยรูปขอบขนานแกมรูปไข่ ถึงรูปหอกแกมรูปไข่ หรือรูปรี หรือรูปใบหอกแกมรี กว้าง 3-12 เซนติเมตร ยาว 10-24 เซนติเมตร ปลายใบแหลมถึงเรียวแหลม โคนใบสอบ หรือกลม หรือเว้า เล็กน้อย ขอบใบจักมน หรือจักแบบฟันเลื่อย หรือแบบซี่ฟันตื้นๆเนื้อใบหนาปานกลาง ด้านล่างมีต่อมขนาดเล็กรูปเหลี่ยม หรือกลม เส้นใบมี 6-16 คู่ หลังใบและท้องใบเป็นลอนตามแนวเส้นใบ ก้านใบย่อยยาวได้ถึง 25 มิลลิเมตร เกลี้ยง หรือมีขน ก้านใบรวมยาว 10-25 เซนติเมตร เกลี้ยง หรือมีขนเล็กน้อย ริ้วประดับมีตั้งแต่รูปสามเหลี่ยมค่อนข้างกว้าง ถึงรูปสามเหลี่ยมแคบ ยาวประมาณ 4 มิลลิเมตรดอกออกเป็นช่อตั้งขึ้น ตามซอกใบ ก้านช่อดอกยาวได้ถึง 15 เซนติเมตร ดอกย่อยสีเขียวอ่อน มีจำนวนมาก ดอกตูมรูปทรงกลมสีแดงเข้มพอบานมีสีขาว กลีบเลี้ยงยาว 2-3 มิลลิเมตร เชื่อมติดกัน ที่โคน ปลายแยกเป็นแฉกแหลม 5 แฉก กลีบดอก 5 กลีบ เชื่อมติดกันที่โคน เกสรเพศผู้มี 5 อัน ติดอยู่กับหลอดเกสรเพศผู้ ปลายอับเรณูจะโผล่พ้นหลอดออกไปเป็นแฉกมนๆ ปลายแฉกเว้า เกสรเพศเมียมี 6 ช่อง แต่ละช่องมีไข่ 1 เมล็ด ก้านเกสรสั้น ปลายมนผลกลม แป้น ผิวบาง มีเนื้อนุ่ม ผลอ่อนมีสีเขียวพอแก่จัดมีสีแดงเข้มจนถึงสีม่วงดำ มี 6 เมล็ด ผลรับประทานได้ ออกดอกราวเดือนมิถุนายนถึงกันยายน พบตามป่าเต็งรัง,หมอยาพื้นบ้านจังหวัดอุบลราชธานีใช้รากฝนกับเหล้าทา รักษาแผลไฟไหม้ น้ำร้อนลวกตำรายาไทยใช้รากรสเย็นเมาเบื่อ ต้มน้ำกินเป็นยาแก้ปวดท้อง ท้องเสีย แก้บิด ขับเหงื่อ และเป็นยาเย็น แก้อาการกระหายน้ำ แก้ไข้ แก้ไข้รากสาด แก้ปวดเมื่อยตามร่างกาย แก้ครั่นเนื้อครั่นตัว ดับร้อน นำรากผสมกับสมุนไพรอื่น ต้มน้ำดื่ม วันละ 3 ครั้ง จนยาหมดรสฝาด แก้ตกขาว มะเร็งลำไส้ มะเร็งมดลูก ใบ ย่างไฟให้เกรียม ใช้พอกศีรษะ แก้วิงเวียน มึนงง ตำเป็นยาพอกแก้ปวดเมื่อยกล้ามเนื้อ และแก้ผื่นคันตามผิวหนัง น้ำยาง จากใบอ่อนกินเป็นยาช่วยย่อยทั้งต้นผสมกับสมุนไพรอื่น ต้มน้ำดื่ม รักษามะเร็งเต้านม,-,-,-
กระทุ่ม,ตับเต่าต้น ตานควาย(อุบลราชธานี) กระทุ่มหูกวาง(ราชบุรี) หูกวาง(พิษณุโลก) ตุ้มหูกวาง ตุ้มปึง ตุ้มโป่ง ตับควาย จับล่อ(เหนือ) ละลาย(นครราชสีมา) หลุมปัง(สุราษฎร์ธานี) ตับเต่าน้อย เต้าแล้ง ตองแล้ง,Neonauclea sessilifolia  (Roxb.)Merr,-,Rubiaceae,ไม้ยืนต้นขนาดกลาง สูงประมาณ 15-30 เมตรเปลือกลำต้นสีเทา แตกเป็นร่องตามยาว แตกกิ่งก้านตั้งฉากกับลำต้น เปลือกรากมีสีดำอ่อนๆใบเป็นใบเดี่ยว ออกเรียงตรงข้ามกัน ใบรูปรี กว้าง 7-17 เซนติเมตร ยาว 20 เซนติเมตร ปลายใบเป็นติ่งแหลม โคนใบมน ขอบใบเรียบ หลังใบเรียบเป็นมัน ท้องใบมีขนหรือบางครั้งเกลี้ยง ก้านใบยาว 2-4 เซนติเมตร มีหูใบรูปสามเหลี่ยมดอกออกเป็นช่อกลมแน่น ออกที่ปลายกิ่ง ดอกย่อยมีขนาดเล็ก สีเหลืองอ่อน มีกลิ่นหอม กลีบดอกมี 5 กลีบอัดแน่นอยู่บนแกนช่อดอก โคนกลีบดอกเชื่อมติดกันเป็นหลอด กลีบเลี้ยงมี 5 กลีบ โคนเชื่อมติดกัน เกสรตัวผู้มี 5 อัน เกสรตัวเมียยาวสีขาวผลเป็นผลรวมที่เกิดจากวงกลีบเลี้ยงเชื่อมติดกัน รูปทรงกลม ผิวขรุขระ เมล็ดมีขนาดเล็กมาก พบตามป่าเบญจพรรณ และป่าดิบทั่วๆไป ชอบขึ้นตามที่ลุ่มต่ำแฉะทั่วไปตามป่าราบ,ตำรายาไทยใช้ใบและเปลือกต้นลดความดันโลหิต ต้มน้ำกินแก้ไข้ แก้ปวดมดลูก แก้โรคลำไส้ และอมกลั้วคอแก้อาการอักเสบของเยื่อเมือกในปากรากฝนหรือต้มรับประทานเป็นยาเย็นดับพิษไข้ทั้งปวง แก้ตัวร้อน ดับพิษตานซางของเด็ก ดับพิษวัณโรคผลเป็นยาฝาดสมานแก้ท้องร่วง,-,-,-
กระเจียวแดง,ดอกดิน กระเจียวโคก กระชายดง (เลย) อาวขาว (เชียงใหม่) ว่านมหาเมฆ,Curcuma sessilis  Gage.,-,Zingiberaceae,ไม้ล้มลุกมีเหง้าใต้ดินอยู่ได้หลายปี  สูง 40-60 เซนติเมตร อาจขึ้นเป็นต้นเดียวหรือหลายต้นรวมกันเป็นกอ สูงประมาณ 20-30 เซนติเมตรใบเป็นกาบห่อรวมตัวกันแน่นเป็นลำต้นเทียม ใบเดี่ยว เรียงสลับ รูปขอบขนาน ปลายใบแหลม ฐานใบแหลม เส้นใบขนาน ยาว 30-40 เซนติเมตร กว้าง 15-20 เซนติเมตร ขอบใบเรียบ ผิวเกลี้ยง หรือมีขนสั้นนุ่มดอกออกเป็นช่อแน่นแบบช่อเชิงลด รูปทรงกระบอก ยาว 10-20 เซนติเมตร  ก้านช่อดอกชูออกจากปลายลำต้นเทียม ช่อดอกย่อย แต่ละช่อมีดอก 2-7 ดอก ใบประดับที่โคนช่อดอกรองรับดอกสีเขียว ดอกสีเหลือง หลอดกลีบเลี้ยงยาวประมาณ 1 เซนติเมตร หลอดกลีบดอกยาว 1-2 เซนติเมตร มีขน แฉกบนรูปรี แฉกข้างแคบกว่าเล็กน้อย กลีบปากรูปไข่กลับ สีเหลือง ปลายแยกเป็น 2 พู เกสรเพศผู้ที่เป็นหมันรูปไข่กลับหรือรูปรี สีเหลือง มีขนสั้น เกสรเพศผู้ที่สมบูรณ์ มีจุดสีแดงจำนวนมาก โคนอับเรณู เรียวแหลมเป็นเดือย 2 อัน โค้งเข้าหากัน เกสรเพศเมีย มีรังไข่ใต้วงกลีบ มีขนสั้นหนาแน่นผลรูปไข่ ผิวมีขนหนาแน่นเมล็ดมีรูปร่างคล้ายหยดน้ำยาวประมาณ 0.5 เซนติเมตร ขยายพันธุ์ด้วยเหง้า เกิดตามป่าดิบทั่วไป ป่าเต็งรัง ป่าเบญจพรรณ ออกดอกช่วงเดือนกุมภาพันธ์ถึงกรกฎาคม ช่อดอกอ่อน หน่ออ่อน นำมาลวก จิ้มน้ำพริก,หน่ออ่อนช่วยสมานแผลดอกอ่อนมีรสเผ็ดร้อน กลิ่นหอม ใช้ขับลมเหง้าแก้ปวดเมื่อย,-,-,-
กระแจะ,พญายา(กลาง ราชบุรี) ขะแจะ (เหนือ) ตุมตัง (ตะวันออกเฉียงเหนือ) ตะนาว (มอญ)พุดไทร ชะแจะ กระแจะจัน พินิยา ฮางแกง,Hesperethusa crenulata  (Roxb.) Roem.,"Naringi crenulata (Roxb.) Nicolson., Limonia crenulata",Rutaceae,ไม้พุ่มกึ่งไม้ต้นหรือไม้ยืนต้นขนาดเล็กถึงขนาดกลาง เนื้อไม้สีขาวเปลือกต้นสีน้ำตาล ขรุขระ ลำต้นและกิ่งมีหนาม มีหนามแข็ง และยาว หนามออกเดี่ยวหรือเป็นคู่ ตรง ยาวได้ถึง 2.5 เซนติเมตร ไม่ผลัดใบ สูง 8-15 เมตร ลำต้นเปลาตรง แตกกิ่งต่ำ กิ่งก้านตั้งฉากกับลำต้น กิ่งอ่อนและยอดอ่อนเกลี้ยงใบประกอบแบบขนนกชั้นเดียว เรียงสลับ ใบย่อย 4-13 ใบ รูปวงรีแกมไข่กลับ กว้าง 1.5-3 เซนติเมตร ยาว 2-7 เซนติเมตร ก้านใบแผ่เป็นปีก ลักษณะเป็นครีบออกสองข้าง เป็นช่วงๆ ระหว่างคู่ใบย่อย โคนและปลายใบสอบแคบ เนื้อใบบางคล้ายกระดาษถึงหนาคล้ายแผ่นหนัง เนียน เกลี้ยง เมื่อส่องดูจะเห็นต่อมน้ำมันเป็นจุดใสๆกระจายอยู่ทั่วไป ขอบใบหยัก เป็นซี่ฟันเลื่อย ตื้นๆ เส้นแขนงใบข้างละ 3-5 เส้น ก้านช่อใบยาวได้ถึง 3 เซนติเมตร ไม่มีก้านใบย่อยดอกออกเป็นช่อแบบช่อกระจะ รวมกันเป็นกระจุกตามกิ่งเล็กๆหรือตามซอกใบ มีขนสั้นนุ่ม ดอกสีขาวหรือสีขาวอมเหลือง กลีบดอกมี 4 กลีบ เมื่อบานจะแผ่ออกหรือลู่ไปทางก้านเล็กน้อย  กลีบดอกรูปไข่แกมรูปรี กว้างประมาณ 3 มิลลิเมตร ยาว 7 มิลลิเมตร เกลี้ยง มีต่อมน้ำมันประปราย เกสรตัวผู้มี 8 อัน ยาว 4-6 มิลลิเมตร ยาวเกือบเท่ากันหรือสลับกันระหว่างสั้นกับยาว เกลี้ยง ก้านชูอับเรณูรูปลิ่มแคบ อับเรณูรูปขอบขนานแกมรูปไข่ยาวประมาณ 2 มิลลิเมตร ปลายเป็นติ่งแหลมสั้นถึงติ่งแหลมอ่อน รังไข่อยู่เหนือวงกลีบ เกือบกลม ยาว 1-2 มิลลิเมตร มีต่อมน้ำมัน เกลี้ยง มี 4 ช่อง แต่ละช่องมีออวุล 1 เม็ด ก้านเกสรเพศเมียยาวประมาณ 1 มิลลิเมตร มีต่อมน้ำมันใต้ยอดเกสรเพศเมีย ยอดเกสรเพศเมียปลายแยกเป็น 5 แฉก จานฐานดอกเกลี้ยง ก้านช่อดอกยาวได้ถึง 2 เซนติเมตร ก้านดอกยาว 8-10 มิลลิเมตร เกลี้ยง หรือมีขน กลีบเลี้ยง 4 กลีบ รูปคล้ายสามเหลี่ยม กว้าง และยาวประมาณ 1.5 มิลลิเมตร ปลายแหลม ผิวด้านนอกมีขนละเอียด และมีต่อมน้ำมัน ด้านในเกลี้ยงผลสด รูปทรงกลม ขนาดเส้นผ่าศูนย์กลาง 0.5-1 เซนติเมตร เมื่ออ่อนสีเขียว แก่จัดสีม่วงคล้ำ ก้านผลยาวได้ถึง 2 เซนติเมตร เมล็ดรูปเกือบกลม กว้างประมาณ 5 มิลลิเมตร สีน้ำตาลอมส้มอ่อน มี 1-4 เมล็ด เนื้อไม้ เมื่อตัดมาใหม่ๆ จะมีสีขาว แล้วเปลี่ยนเป็นสีเหลืองอ่อน ถ้าทิ้งไว้นานๆจะเปลี่ยนเป็นสีน้ำตาลปนเหลืองอ่อน ชาวพม่านิยมนำมาทำเครื่องประทินผิวเรียกว่า“กระแจะตะนาว”หรือ“Thanatka”ชื่อไม้ชนิดนี้เรียกตามชื่อเทือกเขา “ตะนาวศรี” พบตามป่าเบญจพรรณทั่วไป ป่าดิบแล้ง ป่าเต็งรัง ออกดอกราวเดือนมีนาคม ถึงพฤษภาคม ผลจะแก่ราวเดือนพฤษภาคม ถึงตุลาคม,ตำรายาไทยใช้ใบรสขมเฝื่อน ผสมกับสมุนไพรอื่น ต้มกิน แก้ลมบ้าหมูรากรสขมเย็น แก้โรคลำไส้ แก้ปวดท้องบริเวณลำไส้ใหญ่ และบริเวณลิ้นปี่ ขับเหงื่อ ฝนกับน้ำสะอาดใช้ทาหน้าแทนแป้งทำให้ผิวสีเหลือง แก้สิวฝ้า เป็นยาถ่ายผลมีรสขมเฝื่อน แก้พิษ  แก้ไข้ แก้อาหารไม่ย่อย แก้ท้องอืดเฟ้อ เป็นยาบำรุงกำลัง ยาบำรุงร่างกายผลสุกแก้ไข้ เป็นยาสมานแผล ยาบำรุง ช่วยเจริญอาหาร แก่น รสจืด เย็น ดองเหล้ากินแก้กษัย (การป่วยที่เกิดจากหลายสาเหตุ ทำให้ร่างกายเสื่อมโทรม ซูบผอม โลหิตจาง) บำรุงเลือด แก้กระษัย แก้โลหิตพิการ ดับพิษร้อน แก้ไข้ แก้ผอมแห้งเปลือกต้นมีรสขม ใช้แก้ไข้ ขับผายลม บำรุงดวงจิตให้แช่มชื่นยาพื้นบ้านใช้ต้นต้มน้ำดื่มครั้งละครึ่งแก้ว วันละ 3 ครั้ง เช้า กลางวัน เย็น แก้ปวดตามข้อ ปวดเมื่อย เส้นตึง แก้ร้อนใน แก้โรคประดง (อาการโรคผิวหนังมีผื่นคัน เป็นเม็ดขึ้นคล้ายผด คันมาก มักมีไข้ ร่วมด้วย)ชาวพม่าใช้เนื้อไม้นำมาบด ฝน หรือทำให้เป็นผงละเอียด จะมีกลิ่นหอมอ่อนๆ ใช้ทาผิวหนัง ทำให้ผิวเนียนสวย เป็นส่วนผสมหลักในเครื่องประทินผิวแบบโบราณหลายชนิด ใช้ผสมในเครื่องหอม ที่เรียกว่า“กระแจะตะนาว”นิยมใช้กันมากในประเทศพม่า,-,-,-
